{
  "id": "demo",
  "title": "С днём рождения! 🎂",
  "settings": {
    "masterCodeHash": "859bce038a1165f30801d459b6660d47411692f5762d379f16a9553b24557974",
    "adminPinHash": "03ac674216f3e15c761ee1a5e255f067953623c8b388b4459e13f978d7c846f4",
    "defaultRadiusM": 50,
    "maxAccuracyM": 100,
    "hideFuturePoints": true,
    "autoDownload": true
  },
  "masks": [
    {
      "id": "hat",
      "title": "Колпак",
      "src": "assets/masks/hat.png",
      "anchor": "forehead",
      "widthEyes": 2.3,
      "offsetY": -0.8
    },
    {
      "id": "crown",
      "title": "Корона",
      "src": "assets/masks/crown.png",
      "anchor": "forehead",
      "widthEyes": 2.0,
      "offsetY": -0.45
    },
    {
      "id": "cat",
      "title": "Кошка",
      "src": "assets/masks/cat.png",
      "anchor": "forehead",
      "widthEyes": 2.6,
      "offsetY": -0.35
    },
    {
      "id": "bunny",
      "title": "Зайка",
      "src": "assets/masks/bunny.png",
      "anchor": "forehead",
      "widthEyes": 2.0,
      "offsetY": -1.0
    },
    {
      "id": "glasses",
      "title": "Очки",
      "src": "assets/masks/glasses.png",
      "anchor": "eyesMid",
      "widthEyes": 1.9
    },
    {
      "id": "nose",
      "title": "Нос",
      "src": "assets/masks/nose.png",
      "anchor": "noseTip",
      "widthEyes": 0.45
    },
    {
      "id": "mustache",
      "title": "Усы",
      "src": "assets/masks/mustache.png",
      "anchor": "mouth",
      "widthEyes": 1.1,
      "offsetY": -0.22
    },
    {
      "id": "frame-hearts",
      "title": "Сердечки",
      "type": "frame",
      "src": "assets/frames/frame-1.png"
    },
    {
      "id": "frame-balloons",
      "title": "Шарики",
      "type": "frame",
      "src": "assets/frames/frame-balloons.png"
    }
  ],
  "points": [
    {
      "id": "start",
      "name": "Старт — кончик сердца",
      "relative": {
        "northM": 0,
        "eastM": 0
      },
      "radiusM": 50,
      "visitOrder": 1,
      "outlineOrder": 1,
      "steps": [
        {
          "id": "hello",
          "type": "info",
          "title": "С днём рождения! 🎂",
          "image": "assets/img/cake.png",
          "text": "Сегодня тебя ждёт квест: 8 точек, загадки, задания и фото с масками. Пройденный маршрут нарисует на карте сердце ❤️\n\nКамеру с масками можно открыть в любой момент: вкладка «Фото» → «Фотобудка».",
          "buttonText": "Поехали! 🎉"
        },
        {
          "id": "go",
          "type": "geo",
          "title": "В путь!",
          "targetName": "Вы уже здесь — это старт",
          "unlock": {
            "codesHash": [
              "c0660c000bc0482cf5597dfe713d44073e6b2d9c5fdbe9ac02012ded5646f1e0"
            ]
          }
        },
        {
          "id": "selfie",
          "type": "photo",
          "title": "Первое селфи 🥳",
          "text": "Надень праздничный колпак — можно вдвоём, маска встанет на каждое лицо.",
          "defaultMask": "hat",
          "minPhotos": 1
        }
      ]
    },
    {
      "id": "left",
      "name": "Левый бок",
      "relative": {
        "northM": 67,
        "eastM": -57
      },
      "radiusM": 50,
      "visitOrder": 2,
      "outlineOrder": 2,
      "steps": [
        {
          "id": "go",
          "type": "geo",
          "title": "В путь!",
          "targetName": "Левый бок сердца",
          "unlock": {
            "codesHash": [
              "858a04e38222b0f47b5448f70596fa1317a2e63e7e7edd730164370a39c150b5"
            ]
          }
        },
        {
          "id": "candles",
          "type": "riddle",
          "title": "Загадка 🕯️",
          "text": "Их задувают на торте, загадывая желание. Что это?",
          "answersHash": [
            "b46262fdd9397149002698cc3636db71a1c93f861425fd141450b416b9a6a180",
            "9e07dfa66a23b974a6f2d14f6ec66971f6cd2fd1ea21951891452b2effce8e27",
            "d714c4d70f975f0d9ee8e0bdd3c8838091ccdd35b7db90dc24f81396f93fc3b8",
            "2d193deceaf3311ec3b42b4923bd0b2820254bbbe162118148a0cfdde3953575"
          ],
          "hints": [
            "Они горят",
            "Начинается на «св…»"
          ],
          "hintAfterAttempts": 2
        }
      ]
    },
    {
      "id": "left-lobe",
      "name": "Левая половинка",
      "relative": {
        "northM": 136,
        "eastM": -111
      },
      "radiusM": 50,
      "visitOrder": 3,
      "outlineOrder": 3,
      "steps": [
        {
          "id": "go",
          "type": "geo",
          "title": "В путь!",
          "targetName": "Левая половинка сердца",
          "unlock": {
            "codesHash": [
              "49018d4774fb11d3b8c677d294ce1b64144d94ae03e3df195bd7dedff3f1f6c9"
            ]
          }
        },
        {
          "id": "count",
          "type": "choice",
          "title": "Вопрос ❓",
          "text": "Сколько свечей ставят на праздничный торт?",
          "options": [
            "Сколько исполнилось лет",
            "Всегда десять",
            "Ни одной"
          ],
          "correct": [
            0
          ]
        },
        {
          "id": "letters",
          "type": "code",
          "title": "Код 🔢",
          "text": "Посчитай буквы в слове «ПРАЗДНИК» и введи число.",
          "answersHash": [
            "2c624232cdd221771294dfbb310aca000a0df6ac8b66b696d90ef06fdefb64a3"
          ],
          "hints": [
            "П-Р-А-З-Д-Н-И-К"
          ],
          "hintAfterAttempts": 1
        }
      ]
    },
    {
      "id": "left-top",
      "name": "Левая верхушка",
      "relative": {
        "northM": 202,
        "eastM": -64
      },
      "radiusM": 50,
      "visitOrder": 4,
      "outlineOrder": 4,
      "steps": [
        {
          "id": "go",
          "type": "geo",
          "title": "В путь!",
          "targetName": "Верхушка левой половинки",
          "unlock": {
            "codesHash": [
              "ba4bf3806d64056d941bd773d0127dbd9cd777cb64e2174ca5261abcc8076a48"
            ]
          }
        },
        {
          "id": "song",
          "type": "action",
          "title": "Задание 🎤",
          "text": "Спой «С днём рождения тебя» вслух — громко и от души!",
          "buttonText": "Спел(а)! 🎶"
        }
      ]
    },
    {
      "id": "dip",
      "name": "Ямочка сердца",
      "relative": {
        "northM": 154,
        "eastM": 0
      },
      "radiusM": 50,
      "visitOrder": 5,
      "outlineOrder": 5,
      "steps": [
        {
          "id": "go",
          "type": "geo",
          "title": "В путь!",
          "targetName": "Ямочка наверху сердца",
          "unlock": {
            "codesHash": [
              "83e433c4595571724c9085f2dc437be5d867486d4b8422fe262e67d3758ec572"
            ]
          }
        },
        {
          "id": "look",
          "type": "photo",
          "title": "Фото в образе 🐱",
          "text": "Выбери маску: ушки, корона, нос клоуна или усы.",
          "defaultMask": "cat",
          "allowedMasks": [
            "cat",
            "bunny",
            "crown",
            "nose",
            "mustache",
            "glasses"
          ],
          "minPhotos": 1
        },
        {
          "id": "balloons",
          "type": "number",
          "title": "Сколько шариков? 🎈",
          "text": "Сколько воздушных шариков ты хочешь на день рождения?",
          "key": "balloons",
          "min": 1,
          "max": 1000,
          "unit": "шт."
        }
      ]
    },
    {
      "id": "right-top",
      "name": "Правая верхушка",
      "relative": {
        "northM": 202,
        "eastM": 64
      },
      "radiusM": 50,
      "visitOrder": 6,
      "outlineOrder": 6,
      "steps": [
        {
          "id": "go",
          "type": "geo",
          "title": "В путь!",
          "targetName": "Верхушка правой половинки",
          "unlock": {
            "codesHash": [
              "cbd01c6802a77a44be2010f0e965da9067834cf8280d606e51db9b4e60ca2d98"
            ]
          }
        },
        {
          "id": "qr",
          "type": "qr",
          "title": "QR-код 🎁",
          "text": "Найди QR-код у ведущего и отсканируй. (В демо можно ввести вручную: HEART-QR)",
          "answersHash": [
            "328ef99bdaba6bac502a91c16ffc808145f6e0af4832e1b1c3caf4d350517778"
          ]
        }
      ]
    },
    {
      "id": "right-lobe",
      "name": "Правая половинка",
      "relative": {
        "northM": 136,
        "eastM": 111
      },
      "radiusM": 50,
      "visitOrder": 7,
      "outlineOrder": 7,
      "steps": [
        {
          "id": "go",
          "type": "geo",
          "title": "В путь!",
          "targetName": "Правая половинка сердца",
          "unlock": {
            "codesHash": [
              "6f723668ec35ff882c81dfdc8ced228d19bd2726dde7359105822df4053bde9e"
            ]
          }
        },
        {
          "id": "gift",
          "type": "choice",
          "title": "Мечта 💭",
          "text": "Какой подарок самый лучший?",
          "options": [
            "Путешествие ✈️",
            "Сюрприз 🎁",
            "Время с близкими 💞",
            "Торт 🎂"
          ],
          "anyCorrect": true
        },
        {
          "id": "pit",
          "type": "riddle",
          "title": "Загадка 🤔",
          "text": "Чем больше из неё берёшь, тем больше она становится. Что это?",
          "answersHash": [
            "ca0126715ed46e8a52d882f9ae274708d605e5ecb3347b3346e74c9afae8d0f6",
            "97822187486ba5304e1f4b5d0b3c8b7fa11e7fe2b98345d889a6710880edfebb"
          ],
          "hints": [
            "Её копают",
            "Две буквы: «я» и «м»…"
          ],
          "hintAfterAttempts": 2
        }
      ]
    },
    {
      "id": "right",
      "name": "Правый бок",
      "relative": {
        "northM": 67,
        "eastM": 57
      },
      "radiusM": 50,
      "visitOrder": 8,
      "outlineOrder": 8,
      "steps": [
        {
          "id": "go",
          "type": "geo",